{
  "schemaVersion": "1.1.0",
  "testId": "permission-analyzer-unit",
  "sourcePath": "packages/domain/src/device/services/permission-analyzer.service.spec.ts",
  "suiteType": "unit",
  "result": "passed",
  "executedAt": "2026-04-19T02:35:18.997Z",
  "runId": "24619185986",
  "jobName": "Unit Tests",
  "sourceCommitSha": "aeed5437a680abadb91c3d7dc98e6878cb570c70",
  "workflowPath": ".github/workflows/ci-tests.yml",
  "assertions": [
    {
      "assertionId": "location-denied-rule",
      "name": "Location denied rule is asserted",
      "status": "passed",
      "expected": "Permission analyzer tests assert LOCATION_DENIED rule.",
      "actual": "Matched includes assertion in packages/domain/src/device/services/permission-analyzer.service.spec.ts.",
      "evidenceRef": {
        "filePath": "packages/domain/src/device/services/permission-analyzer.service.spec.ts",
        "matcherType": "includes",
        "matcher": "IssueCode.LOCATION_DENIED"
      },
      "verifiedAt": "2026-04-19T02:35:18.997Z"
    },
    {
      "assertionId": "location-denied-severity-critical",
      "name": "Location denied severity is critical",
      "status": "passed",
      "expected": "Permission analyzer tests assert LOCATION_DENIED as CRITICAL.",
      "actual": "Matched includes assertion in packages/domain/src/device/services/permission-analyzer.service.spec.ts.",
      "evidenceRef": {
        "filePath": "packages/domain/src/device/services/permission-analyzer.service.spec.ts",
        "matcherType": "includes",
        "matcher": "IssueSeverity.CRITICAL"
      },
      "verifiedAt": "2026-04-19T02:35:18.997Z"
    },
    {
      "assertionId": "notifications-denied-rule",
      "name": "Notifications denied rule is asserted",
      "status": "passed",
      "expected": "Permission analyzer tests assert NOTIFICATIONS_DENIED rule.",
      "actual": "Matched includes assertion in packages/domain/src/device/services/permission-analyzer.service.spec.ts.",
      "evidenceRef": {
        "filePath": "packages/domain/src/device/services/permission-analyzer.service.spec.ts",
        "matcherType": "includes",
        "matcher": "IssueCode.NOTIFICATIONS_DENIED"
      },
      "verifiedAt": "2026-04-19T02:35:18.997Z"
    },
    {
      "assertionId": "notifications-denied-severity-warning",
      "name": "Notifications denied severity is warning",
      "status": "passed",
      "expected": "Permission analyzer tests assert NOTIFICATIONS_DENIED as WARNING.",
      "actual": "Matched includes assertion in packages/domain/src/device/services/permission-analyzer.service.spec.ts.",
      "evidenceRef": {
        "filePath": "packages/domain/src/device/services/permission-analyzer.service.spec.ts",
        "matcherType": "includes",
        "matcher": "IssueSeverity.WARNING"
      },
      "verifiedAt": "2026-04-19T02:35:18.997Z"
    }
  ]
}
