{
  "schemaVersion": "1.1.0",
  "testId": "device-sync-e2e",
  "sourcePath": "apps/api/test/device-sync.e2e.spec.ts",
  "suiteType": "e2e",
  "result": "passed",
  "executedAt": "2026-04-19T02:35:19.036Z",
  "runId": "24619185986",
  "jobName": "Integration And E2E Tests",
  "sourceCommitSha": "aeed5437a680abadb91c3d7dc98e6878cb570c70",
  "workflowPath": ".github/workflows/ci-tests.yml",
  "assertions": [
    {
      "assertionId": "device-sync-endpoint-exists",
      "name": "Device sync endpoint assertion exists",
      "status": "passed",
      "expected": "Device sync E2E test must call /devices/sync/v1 endpoint.",
      "actual": "Matched includes assertion in apps/api/test/device-sync.e2e.spec.ts.",
      "evidenceRef": {
        "filePath": "apps/api/test/device-sync.e2e.spec.ts",
        "matcherType": "includes",
        "matcher": ".post(\"/devices/sync/v1\")"
      },
      "verifiedAt": "2026-04-19T02:35:19.036Z"
    },
    {
      "assertionId": "device-sync-durable-inbox-assertion",
      "name": "Device sync durable inbox assertion exists",
      "status": "passed",
      "expected": "Device sync E2E test must assert durable inbox write with toBeDefined().",
      "actual": "Matched includes assertion in apps/api/test/device-sync.e2e.spec.ts.",
      "evidenceRef": {
        "filePath": "apps/api/test/device-sync.e2e.spec.ts",
        "matcherType": "includes",
        "matcher": "expect(inbox).toBeDefined();"
      },
      "verifiedAt": "2026-04-19T02:35:19.036Z"
    },
    {
      "assertionId": "device-sync-record-processing-assertion",
      "name": "Device sync record processing assertion exists",
      "status": "passed",
      "expected": "Device sync E2E test must assert asynchronous location record processing.",
      "actual": "Matched includes assertion in apps/api/test/device-sync.e2e.spec.ts.",
      "evidenceRef": {
        "filePath": "apps/api/test/device-sync.e2e.spec.ts",
        "matcherType": "includes",
        "matcher": "expect(foundLocation).toBe(true);"
      },
      "verifiedAt": "2026-04-19T02:35:19.036Z"
    }
  ]
}
