{
  "schemaVersion": "1.1.0",
  "testId": "ttl-indexes-api-unit",
  "sourcePath": "apps/api/src/schemas/ttl-indexes.spec.ts",
  "suiteType": "unit",
  "result": "passed",
  "executedAt": "2026-03-08T12:21:40.703Z",
  "runId": "22820901971",
  "jobName": "Unit Tests",
  "sourceCommitSha": "ed7c46406bddcd734e208ad518bc586124a7f32a",
  "workflowPath": ".github/workflows/ci-tests.yml",
  "assertions": [
    {
      "assertionId": "refresh-token-expiration-index",
      "name": "Refresh token TTL assertion exists",
      "status": "passed",
      "expected": "RefreshTokenSchema expiresAt must use expireAfterSeconds=0.",
      "actual": "Matched includes assertion in apps/api/src/schemas/ttl-indexes.spec.ts.",
      "evidenceRef": {
        "filePath": "apps/api/src/schemas/ttl-indexes.spec.ts",
        "matcherType": "includes",
        "matcher": "expectExpireAfterSeconds(RefreshTokenSchema, \"expiresAt\", 0);"
      },
      "verifiedAt": "2026-03-08T12:21:40.703Z"
    },
    {
      "assertionId": "media-deleteat-expiration-index",
      "name": "Media deleteAt TTL assertion exists",
      "status": "passed",
      "expected": "MediaSchema deleteAt must use expireAfterSeconds=0.",
      "actual": "Matched includes assertion in apps/api/src/schemas/ttl-indexes.spec.ts.",
      "evidenceRef": {
        "filePath": "apps/api/src/schemas/ttl-indexes.spec.ts",
        "matcherType": "includes",
        "matcher": "expectExpireAfterSeconds(MediaSchema, \"deleteAt\", 0);"
      },
      "verifiedAt": "2026-03-08T12:21:40.703Z"
    }
  ]
}
